{   "$schema": "https://json-schema.org/draft/2020-12/schema",   "$id": "schemas/ELIS_Appendix_C_Extraction.schema.json",   "title": "Appendix C â€” Extraction Rows",   "type": "array",   "items": {     "type": "object",     "additionalProperties": false,     "properties": {       "id": { "type": "string", "minLength": 1 },       "screening_id": { "type": "string", "minLength": 1, "description": "References B.id" },       "key_findings": { "type": "string", "minLength": 1 },       "extracted_at": { "type": "string", "format": "date-time" },       "notes": { "type": "string" }     },     "required": ["id", "screening_id", "key_findings", "extracted_at"]   } }
