[
  {
    "id": "C-B-A-0001",
    "screening_id": "B-A-0001",
    "key_findings": "MVP toy extraction placeholder",
    "extracted_at": "2025-10-20T13:47:33Z",
    "notes": "Auto-generated by toy agent."
  },
  {
    "id": "C-B-A-0003",
    "screening_id": "B-A-0003",
    "key_findings": "MVP toy extraction placeholder",
    "extracted_at": "2025-10-20T13:47:33Z",
    "notes": "Auto-generated by toy agent."
  },
  {
    "id": "C-B-A-0005",
    "screening_id": "B-A-0005",
    "key_findings": "MVP toy extraction placeholder",
    "extracted_at": "2025-10-20T13:47:33Z",
    "notes": "Auto-generated by toy agent."
  },
  {
    "id": "C-B-A-0007",
    "screening_id": "B-A-0007",
    "key_findings": "MVP toy extraction placeholder",
    "extracted_at": "2025-10-20T13:47:33Z",
    "notes": "Auto-generated by toy agent."
  }
]
